{
  "status": "generated",
  "detected": true,
  "analysis": {
    "duration_s": 4,
    "character": "young adult student/creator, original fictional person, not the reference creator",
    "framing": "vertical 9:16 medium close-up, laptop clearly beside her but blurred enough to avoid readable text",
    "action": "looks at camera, tucks hair behind ear, glances at laptop, then presents it with both hands low in frame",
    "emotion": "quietly excited and a little smug",
    "atmosphere": "a petite fictional young adult college student creator, soft round face, long light-brown hair, natural no-makeup look, cozy StudyTok energy, wearing pale blue crewneck sweatshirt, creator-native and natural",
    "environment": "cozy study corner, laptop angled toward her, notebook open, small desk lamp, no readable screen text",
    "camera": "front-facing phone, gentle handheld drift, authentic casual framing",
    "lighting_color": "golden desk lamp with soft daylight in background",
    "must_change": [
      "new generated clip",
      "gesture timing",
      "camera angle",
      "outfit",
      "desk layout",
      "props",
      "lighting balance"
    ],
    "overlay_policy": "generate clean silent reaction video without baked-in text; renderer will add hook copy as captions later",
    "speech_policy": "no speaking, no lip-sync, no dialogue; use only facial expression, posture, glance, and hand gesture",
    "identity_policy": "do not copy the reference person's face, identity, clothing, or exact likeness",
    "differentiation_policy": "do not remake the reference one-to-one; change at least 3 visible attributes while preserving only emotional function and hook rhythm"
  },
  "text_to_video_prompt": "Realistic vertical 9:16 smartphone selfie video, 4 seconds. An original young adult student creator sits at a cozy study corner, laptop angled toward her, notebook open, small desk lamp, no readable screen text. The creator looks quietly excited and a little smug, looks at camera, tucks hair behind ear, glances at laptop, then presents it with both hands low in frame. golden desk lamp with soft daylight in background, a petite fictional young adult college student creator, soft round face, long light-brown hair, natural no-makeup look, cozy StudyTok energy, wearing pale blue crewneck sweatshirt, creator-native and natural. Natural handheld phone motion, authentic TikTok studytok style, close-up face first, laptop visible but not brand-specific, no logos, no readable text, no subtitles baked into the video. Silent reaction only: the creator does not speak, does not lip-sync, and communicates through facial expression, posture, glances, and a small gesture. Do not remake the reference video exactly; use a different face, outfit, room layout, props, lighting variation, and gesture timing. The moment should feel like a peer reacting before showing a useful study workflow tool workflow.",
  "negative_prompt": "Do not imitate or recreate the reference creator's face or identity. No speaking, no talking mouth, no lip-sync, no dialogue, no voiceover. No one-to-one remake of the reference video, no same outfit, no same room, no same exact pose sequence. No watermark, no logo, no readable on-screen text, no distorted hands, no extra limbs, no uncanny face, no product UI.",
  "generation": {
    "provider": "evolink",
    "model": "seedance-2.0-text-to-video",
    "dry_run": false,
    "attempted": true,
    "status": "completed",
    "task_id": "task-unified-1780156638-1zeqniui",
    "task_create_path": "/Users/kk/Desktop/auto video/projects/generated/2026-05-30_same-girl-new-ai-human-hooks/output/generated_hooks_new_16/new_same_girl_05_05_screen_present/evolink_task_create.json",
    "task_status_path": "/Users/kk/Desktop/auto video/projects/generated/2026-05-30_same-girl-new-ai-human-hooks/output/generated_hooks_new_16/new_same_girl_05_05_screen_present/evolink_task_status.json",
    "video_path": "/Users/kk/Desktop/auto video/projects/generated/2026-05-30_same-girl-new-ai-human-hooks/output/generated_hooks_new_16/new_same_girl_05_05_screen_present/ai_human_hook.mp4"
  },
  "asset": {
    "clip_id": "ai_human_hook",
    "file_path": "/Users/kk/Desktop/auto video/projects/generated/2026-05-30_same-girl-new-ai-human-hooks/output/generated_hooks_new_16/new_same_girl_05_05_screen_present/ai_human_hook.mp4",
    "thumbnail_path": "/Users/kk/Desktop/auto video/projects/generated/2026-05-30_same-girl-new-ai-human-hooks/output/generated_hooks_new_16/new_same_girl_05_05_screen_present/materials/contact_sheets/ai_human_hook.jpg",
    "duration": 4.042,
    "orientation": "vertical_ai_selfie_intro",
    "quality_score": 8,
    "shot_type": "AI generated human selfie hook",
    "camera_motion": "subtle handheld selfie movement",
    "scene": "cozy study corner, laptop angled toward her, notebook open, small desk lamp, no readable screen text",
    "visible_objects": [
      "student creator",
      "laptop",
      "study desk"
    ],
    "emotion": "quietly excited and a little smug",
    "best_use": [
      "human hook",
      "opening hook",
      "creator reaction",
      "student anxiety setup"
    ],
    "not_good_for": [
      "product proof",
      "final result proof"
    ],
    "usable_segments": [
      {
        "start": 0,
        "end": 4.0,
        "reason": "AI-generated opening human hook based on reference hook analysis."
      }
    ],
    "text_overlay_safe_area": "lower center; keep face readable",
    "audio_quality": "not needed",
    "notes": "Generated from human_hook_generation; use only as the opening hook."
  },
  "evidence_gaps": []
}