{
  "status": "generated",
  "detected": true,
  "analysis": {
    "duration_s": 4,
    "character": "young adult student/creator, original fictional person, not the reference creator",
    "framing": "vertical 9:16 close-up selfie, face in the upper half, lower-middle clear for captions",
    "action": "covers part of the mouth, raises eyebrows, glances down at the laptop, then gives a tiny point toward the screen",
    "emotion": "caught-off-guard academic panic with nervous amusement",
    "atmosphere": "creator-native study panic, original person wearing dark hoodie and simple wired earbuds",
    "environment": "small dorm desk with a silver laptop, open notebook, sticky notes, and one warm desk lamp",
    "camera": "front-facing phone selfie with a slight lean-in and gentle handheld drift",
    "lighting_color": "warm desk lamp lighting with soft shadows",
    "must_change": [
      "face",
      "hair",
      "outfit",
      "desk layout",
      "props",
      "lighting",
      "gesture timing",
      "camera distance"
    ],
    "overlay_policy": "generate clean silent reaction video without baked-in text; renderer will add hook copy as captions later",
    "speech_policy": "no speaking, no lip-sync, no dialogue; use only facial expression, posture, glance, and hand gesture",
    "identity_policy": "do not copy the reference person's face, identity, clothing, or exact likeness",
    "differentiation_policy": "do not remake the reference one-to-one; change at least 3 visible attributes while preserving only emotional function and hook rhythm"
  },
  "text_to_video_prompt": "Realistic vertical 9:16 smartphone selfie video, 4 seconds. An original young adult student creator sits at a small dorm desk with a silver laptop, open notebook, sticky notes, and one warm desk lamp. The creator looks caught-off-guard academic panic with nervous amusement, covers part of the mouth, raises eyebrows, glances down at the laptop, then gives a tiny point toward the screen. warm desk lamp lighting with soft shadows, creator-native study panic, original person wearing dark hoodie and simple wired earbuds. Natural handheld phone motion, authentic TikTok studytok style, close-up face first, laptop visible but not brand-specific, no logos, no readable text, no subtitles baked into the video. Silent reaction only: the creator does not speak, does not lip-sync, and communicates through facial expression, posture, glances, and a small gesture. Do not remake the reference video exactly; use a different face, outfit, room layout, props, lighting variation, and gesture timing. The moment should feel like a peer reacting before showing a useful Clearfy workflow.",
  "negative_prompt": "Do not imitate or recreate the reference creator's face or identity. No speaking, no talking mouth, no lip-sync, no dialogue, no voiceover. No one-to-one remake of the reference video, no same outfit, no same room, no same exact pose sequence. No watermark, no logo, no readable on-screen text, no distorted hands, no extra limbs, no uncanny face, no product UI.",
  "generation": {
    "provider": "evolink",
    "model": "seedance-2.0-text-to-video",
    "dry_run": false,
    "attempted": true,
    "status": "completed",
    "task_id": "task-unified-1779955216-lwi3lpbs",
    "task_create_path": "/Users/kk/Desktop/auto video/projects/batch/ariana-study-7637977216189500685-16-ai-humans/clearfy/clearfy_human_01/output/generated_hooks/evolink_task_create.json",
    "task_status_path": "/Users/kk/Desktop/auto video/projects/batch/ariana-study-7637977216189500685-16-ai-humans/clearfy/clearfy_human_01/output/generated_hooks/evolink_task_status.json",
    "video_path": "/Users/kk/Desktop/auto video/projects/batch/ariana-study-7637977216189500685-16-ai-humans/clearfy/clearfy_human_01/output/generated_hooks/ai_human_hook.mp4"
  },
  "asset": {
    "clip_id": "ai_human_hook",
    "file_path": "/Users/kk/Desktop/auto video/projects/batch/ariana-study-7637977216189500685-16-ai-humans/clearfy/clearfy_human_01/output/generated_hooks/ai_human_hook.mp4",
    "thumbnail_path": "/Users/kk/Desktop/auto video/projects/batch/ariana-study-7637977216189500685-16-ai-humans/clearfy/clearfy_human_01/materials/contact_sheets/ai_human_hook.jpg",
    "duration": 4.042,
    "orientation": "vertical_ai_selfie_intro",
    "quality_score": 8,
    "shot_type": "AI generated human selfie hook",
    "camera_motion": "subtle handheld selfie movement",
    "scene": "small dorm desk with a silver laptop, open notebook, sticky notes, and one warm desk lamp",
    "visible_objects": [
      "student creator",
      "laptop",
      "study desk"
    ],
    "emotion": "caught-off-guard academic panic with nervous amusement",
    "best_use": [
      "human hook",
      "opening hook",
      "creator reaction",
      "student anxiety setup"
    ],
    "not_good_for": [
      "product proof",
      "final result proof"
    ],
    "usable_segments": [
      {
        "start": 0,
        "end": 4.0,
        "reason": "AI-generated opening human hook based on reference hook analysis."
      }
    ],
    "text_overlay_safe_area": "lower center; keep face readable",
    "audio_quality": "not needed",
    "notes": "Generated from human_hook_generation; use only as the opening hook."
  },
  "evidence_gaps": []
}